{
  "schema_version": "2.0.0",
  "governance_version": "1.0.0",
  "record_type": "receipt",
  "operation": "create",
  "hold_id": "01957e8a-1234-7abc-8abc-0123456789ab",
  "tenant_id": "01957e8a-3456-7abc-8abc-0123456789ab",
  "command_id": "01957e8a-4567-7abc-8abc-0123456789ab",
  "receipt_id": "01957e8a-5678-7abc-8abc-0123456789ab",
  "scope_type": "artifact_set",
  "scope_hmac": null,
  "artifact_count": 7,
  "purpose_code": "litigation",
  "authority_code": "counsel_instruction",
  "authorized_by_actor_id": null,
  "authorization_id": "01957e8a-6789-7abc-8abc-0123456789ab",
  "starts_at": "2026-08-31T12:00:00Z",
  "expires_at": "2026-11-30T12:00:00Z",
  "outcome": "created",
  "outcome_code": null,
  "record_fingerprint": "aaaaaaaaaaaaaaaaaaaaaaaaaaaaaaaaaaaaaaaaaaaaaaaaaaaaaaaaaaaaaaaa",
  "trace_id": "0123456789abcdef0123456789abcdef",
  "correlation_id": "01957e8a-89ab-7abc-8abc-0123456789ab",
  "recorded_at": "2026-08-31T12:00:01Z",
  "data_classification": "internal"
}
